LINK_ID,overspeed_rate,jam_rate,borough,link_name
4616202,0.6954721609230885,0.063635453,Staten Island,WSE S ARDEN AVENUE - BLOOMINGDALE ROAD
4616216,1.2514443753832548e-05,0.8031206851240807,Staten Island,SIE E-MLK N RICHMOND AVENUE - WALKER STREET
4456477,0.000289722,0.00694291,Queens,MDE S TBB EXIT RAMP - QUEENS ANCHORAGE
4456476,0.00025762,0.003097673,Queens,TBB N QUEENS ANCHORAGE - MANHATTAN LIFT SPAN
4575278,0,0.033333333,Bronx,MDE N VAN CORTLAND PARK - NYST N EXIT 1 (MP.48)
4616217,0.00105661,0.5991041784125791,Staten Island,SIE W - MLK N WOOLEY AVENUE - WLAKER STREET
4616203,0.004284236,0.15651228954262544,Staten Island,WSE S BLLOMINGDALE ROAD - TYRELLAN AVENUE
4456516,0.19384218756603694,0.036367863,Queens,LIE W 84TH ST - QMT TOLL PLAZA
4456502,0.001153589,0.1372203754522952,Manhattan,BBT E Manhattan Portal - Toll Plaza
4456500,0.000315849,0.020486532,Queens,Whitestone Expwy N Exit 14 (Linden Pl) - BWB N Queens Anchorage
4616215,0.004857886,0.15616663373184467,Staten Island,WSE N TYRELLAN AVENUE - BLOOMINGDALE ROAD
4616201,0.3791035623478665,0.093473305,Staten Island,WSE S VICTORY BOULEVARD - ARDEN AVENUE
4616229,9.670105383573988e-05,0.1918754655024134,Brooklyn,BQE S - GOW S ALTANTIC AVENUE - 9TH STREET
4763649,0.004444383,0.10983845671984381,Brooklyn,VNB W BROOKLYN GANTRY UPPER LEVEL - SI GANTRY UPPER LEVEL
4763648,0.000211494,0.090698728,Staten Island,SIE E VNB E FINGERBOARD ROAD - SI GANTRY UPPER LEVEL
4616228,0.18083931587176666,0.4680241235990005,Bronx,I-87 NYST S Exit 1 - MDE S Van Cortlandt Park
4616200,0.098420015,0.06204595,Staten Island,WSE S SOUTH AVENUE - VICTORY BOULEVARD
4616214,0.2296686173486506,0.059644348751474334,Staten Island,WSE N BLOOMUINGDALE ROAD - ARDEN AVENUE
4456501,0.000817446,0.10605731814456577,Manhattan,BBT W Toll Plaza - Manhattan Portal
4456511,0.00010609,0.10823651775963389,Manhattan,QMT E Manhattan Side - Toll Plaza
4616199,0.27925496412481227,0.063688887,Staten Island,SIE W - WSE S SOUTH AVENUE - SOUTH AVENUE
4456505,0.003622538,0.037965702743196265,Queens,TNB N Queens Anchorage - Toll Plaza
4616364,0.10725373048408916,0.012428093865517539,Queens,LIE W 108TH ST - 84TH ST
4616210,0.005984921,0.5283556021668758,Staten Island,MLK S - SIE W WALKER STREET - RICHMOND AVENUE
4616205,0.001167367,0.093431221,Staten Island,VNB W-SIE W SI GANTRY LOWER LEVEL - FINGERBOARD ROAD
4616211,0.1610900801468844,0.060057557,Staten Island,SIE W RICHMOND AVENUE - SOUTH AVENUE
4616239,0.001538968,0.012634762570981813,Queens,Whitestone Expwy S Exit 14 (Linden Pl) - VWE S MP8.65 (Exit 13 Northern Blvd)
4616365,0.099409365,0.010537945100705362,Queens,LIE E QMT TOLL PLAZA - 84TH ST
4616198,0.14441284030881754,0.063140895,Staten Island,WSE N-SIE E SOUTH AVENUE - SOUTH AVENUE
4456510,4.842339734345031e-05,0.093554004,Queens,QMT W Toll Plaza - Manhattan Side
4456506,0.004173529,0.028109820926014717,Queens,TNB S Toll Plaza - Queens Anchorage
4616213,0.25227246529550285,0.092944654,Staten Island,WSE N ARDEN AVENUE - VICTORY BLVD
4456498,0.028882272102611087,0.035761878982217964,Bronx,HRP S Lafayette Ave - BWB S Toll Plaza
4616212,0.37565020141577693,0.061431297,Staten Island,WSE N VICTORY BLVD - SOUTH AVENUE
4616206,0.07387498,0.052523246,Staten Island,SIE W FINGERBOARD ROAD - CLOVE ROAD
4620314,0.000303805,0.10865593501077882,Bronx,MDE S HARLEM RIVER PARK - GWB W AMSTERDAM AVENUE UPPER LEVEL
4616329,0.000273816,0.034766443,Manhattan,FDR N 25th - 63rd St
4616261,0.014625025226212196,0.002580281,Bronx,BE S Griswold - Castle Hill Avenue
4616260,0.028458782548258715,0.001795481,Bronx,BE S CASTLE HILL AVENUE - STRATFORD AVENUE
4616328,0.000841999,0.024477826321144293,Manhattan,FDR N Catherine Slip - 25th St
4616300,0.001914013,0.006750499,Queens,VWE N MP8.64 (Exit 13 Northern Blvd) - Whitestone Expwy Exit 14 (Linden Pl)
4620315,4.596500391747192e-05,0.6914264821102115,Bronx,CBE W L/LE V AMSTERDAM AVE - I 95 S LOC LNS
4616276,0.003577895,0.018753600526705622,Queens,VWE S MP2.66 (Exit 2 Rockaway Blvd) - Belt Pkwy E 182nd St
4329472,0.000205845,0.17047722811803454,Manhattan,LINCOLN TUNNEL E SOUTH TUBE - NJ - NY
4329499,0.000229294,0.8412173177694148,Staten Island,MLK N WALKER STREET - NJ ROUTE 169
4616267,0.031575961,0.001510959,Bronx,CBE W CASTLE HILL AVENUE - TAYLOR AVENUE
4616298,0.001887401,0.035430926,Queens,VWE N MP4.63 (Exit 6 - Jamaica Ave) - MP6.39 (Exit 11 Jewel Ave)
4362249,0.008239937,0.062658629,Queens,LIE WB LITTLE NECK PKWY - NB CIP
4620298,0.047693777434588865,0.095591526,Manhattan,GWB E LOWER LEVEL PLAZA - CBE E LOWER LEVEL AMSTERDAM AVE
4616299,0.002253601,0.019354214645731845,Queens,VWE N MP6.39 (Exit 11 Jewel Ave) - MP8.65 (Exit 13 Northern Blvd)
4616266,0.091859759,0.5225904299062331,Bronx,BRP S FORDHAM ROAD - WATSON AVENUE
4616272,0.002277872,0.008159632,Queens,VWE S MP4.63 (Exit 6 Jamaica Ave) - MP2.66 (Exit 2 Roackaway Blvd)
4329507,0.000247453,0.031372427,Manhattan,LINCOLN TUNNEL W NORTH TUBE NY - NJ
4616312,0.002588864,0.017597253,Queens,BWB S Queens Anchorage - WSE S Exit 14 (Linden Pl)
4329473,0.00023167,0.3892513514077599,Manhattan,LINCOLN TUNNEL E CENTER TUBE NJ - NY
4362314,0.010441012,0.02524724,Queens,TNB S Qns Anchorage - CIP S @ TNB
4616338,0.000197375,0.16398565742294155,Manhattan,12th Ave N 40th - 57th St
4616310,0.000732373,0.07238768,Bronx,CBE AMSTERDAM AVE (L/LVL) - MORRIS AVE
4616271,0.000106998,0.003385737,Brooklyn,BQE S LEONARD STREET - ATLANTIC AVENUE
4616259,0.001899679,0.014261982985127406,Queens,VWE S MP6.39 (Exit 11 Jewel Ave) - MP4.63 (Exit 6 Jamaica Ave)
4616305,0.13897617150242167,0.051839678928440186,Bronx,BWB N Toll Plaza - HRP N Lafayatte Ave
4616339,2.0574988632318782e-06,0.056243789,Manhattan,BQE N Atlantic Ave - BKN Bridge Manhattan Side
4620310,0.000374436,0.32837621665699374,Bronx,CBE W U/LEV AMSTERDAM AVE - I95 S EXP LNS
4616320,0.058113736,0.024771313121297007,Queens,CIP N TNB - Whitestone Expwy S Exit 14 (Linden Pl)
4616297,0.00428736,0.000921659,Bronx,CBE E CASTLE HILL AVE - BE N WATERBURY AVE
4362252,0.058094947,0.026507152624162113,Queens,CIP N LIE ramp - TNB
4362247,0.11951446855289392,0.048891713,Queens,CIP NB GCP - TNB
4616282,0.000153133,0.8054627213449246,Staten Island,ROUTE 169 S - MLK WALKER STREET
4329508,0.000154777,0.36309787746701583,Manhattan,LINCOLN TUNNEL W CENTER TUBE NY - NJ
4616255,0.000242876,0.22148010167851886,Bronx,MDE N RFK Bridge - 142nd St
4616241,0.001604671,0.014275398544686997,Queens,VWE S MP8.65 (Exit 13 Northern Blvd) - MP6.39 (Exit 11 Jewel Ave)
4329483,0.002722187,0.20366662781792147,Staten Island,WSE S TYRELLAN AVENUE - 440 S FRANCIS STREET
4616309,0.001000809,0.075626999,Bronx,CBE E AMSTERDAM AVE(U/LVL) - MORRIS AVE
4616323,0.00012979,0.029874453541217722,Manhattan,12th Ave S 57th St - 45th St
4616337,0.000275465,0.022403124678795353,Manhattan,11th ave n ganservoort - 12th ave @ 40th st
4616257,0.000110445,0.15817636171136518,Brooklyn,BQE N ATLANTIC AVENUE - LEONARD STREET
4362251,0.018099986,0.00574511,Queens,LIE WB LITTLE NECK PKWY - NB CVE
4362244,0.011737781914158184,0.008547449,Queens,CVE NB LIE - WILLETS PT BLVD
4362250,0.12223493122685022,0.060056241,Queens,CVE NB GCP - WILLETS PT BLVD
4616281,0.00479109,0.19261702977143538,Staten Island,440 N FRANCIS STREET - WSE N TYRELLAN AVE
4616332,0.001142134,0.023125117,Manhattan,FDR S 63rd - 25th St
4616252,0.022382934,0.052065769018811124,Bronx,BRP N WATSON AVENUE - FORDHAM ROAD
4616246,0.14499573427076587,0.002360028,Bronx,BE N STRATFORD AVENUE - CASTLE HILL AVE
4616247,0.021705946248415924,0.002322625,Bronx,BE N Castle Hill Avenue - Griswold Ave
4616253,0.029554939,0.001282763,Bronx,CBE E TAYLOR AVENUE - CASTLE HILL AVENUE
4616333,0.000490592,0.019450537,Manhattan,FDR S 25th St - Catherine Slip
4620332,0.00020338,0.11554904369770222,Bronx,CBE W MORRIS AVE - GWB W AMSTERDAM AVE (L/LVL)
4620330,0.004628284,0.1004254700925657,Bronx,MDE S HARLEM RIVER PARK - GWB W AMSTERDAM AVENUE LOWER LEVEL
4616319,0.001307529,0.2097647299334736,Brooklyn,GOW S 9TH STREET - 7TH AVENUE
4616325,4.111850558903287e-06,0.604750421,Manhattan,11th ave s ganservoort - west st @ spring st
4616250,0.42201704428381864,0.024993612514526378,Bronx,HRP N LAFAYETTE AVENUE - E TREMONT AVENUE
4616324,3.084439619010018e-05,0.011332231160242807,Manhattan,12th ave @ 45th - 11 ave ganservoort st
4616318,0.000786607,0.10951645937843213,Brooklyn,GOW N 7TH AVENUE - 9TH STREET
4620331,4.980958211836002e-05,0.11478618199176066,Bronx,CBE W MORRIS AVE - GWB W AMSTERDAM AVE (U/LVL)
4616196,0.000122973,0.5951206803118095,Staten Island,MLK S - SIE E WALKER STREET - WOOLEY AVENUE
4616357,0.000930357,0.021914847633455803,Queens,Belt Pkwy W JFK Expressway - VWE N Jamaica Ave
4616223,2.467343678357078e-05,0.1837944867205507,Brooklyn,GOW N 9TH STREET - ATLANTIC AVENUE
4763657,0.000502074,0.052990091,Brooklyn,GOW S VNB W 92ND STREET - BKLYN GANTRY LOWER LEVEL
4456481,1.0425571842615567e-05,0.08650931,Queens,TBB S MANHATTAN LIFT SPAN - QUEENS ANCHORAGE
4456494,0,0.6663313845057731,Manhattan,West St S Spring St - BBT Manhattan Portal outbound
4763656,0.013525192720336962,0.051701700707303504,Brooklyn,VNB E SI GANTRY LOWER LEVEL - BROOLKYN GANTRY LOWER LEVEL
4616342,3.08413520848754e-05,0.023754009375771035,Manhattan,BKN Bridge Manhattan Side - FDR N Catherine Slip
4616356,0.037405786,0.016737797,Queens,Belt Pkwy W 182nd St - JFK Expressway
4620343,0.000951746,0.15867345772524474,Manhattan,Westside Hwy N 57th St - GWB
4616197,0.057940634083829094,0.058042738,Staten Island,SIE E SOUTH AVENUE - RICHMOND AVENUE
4616195,0.064764497,0.07479767,Staten Island,SIE E RICHMOND AVENUE - WOOLEY AVENUE
4616340,2.7010685842868453e-05,0.20408858673858435,Manhattan,BQE N Atlantic Ave - MAN Bridge Manhattan Side
4616354,0.070414976,0.012386982153615852,Queens,Laurelton Pkwy S @ SSP - Belt Pkwy W 182nd St
4616220,0.000594166,0.057695787,Brooklyn,GOW N 92ND STREET - 7TH AVENUE
4616208,0.051970957,0.058601251,Staten Island,SIE W BRADLEY AVENUE - WOOLEY AVENUE
4456496,0.005578542,0.028832518972866202,Bronx,BWB S Toll Plaza - Queens Anchorage
4456497,0.001356386,0.026917275060839418,Queens,BWB N Queens Anchorage - Toll Plaza
4456483,0.029028156146006547,0.019648323929914526,Queens,CIP N ramp to TNB - TNB Queens Anchorage
4763655,0.000544208,0.040947269,Brooklyn,GOW S VNB W 92ND STREET - BKLYN GANTRY UPPER LEVEL
4616209,0.3604220750990597,0.075190149,Staten Island,SIE W WOOLEY AVENUE - RICHMOND AVENUE
4616235,0.009530938,0.12436897376370265,Brooklyn,BQE N LEONARD STREET - 46TH STREET
4616355,0.046398197042228036,0.028220566220862327,Queens,Belt Pkwy E 182nd St - Laurelton Pkwy N @ SSP
4616341,0.000121456,0.027786584,Manhattan,FDR S Catherine Slip - BKN Bridge Manhattan Side
4616194,0.022951906025135818,0.059315694,Staten Island,SIE E WOOLEY AVENUE - BRADLEY AVENUE
4616351,0.048979801719527746,0.083318935,Queens,CIP N Hempstead Tpk - LIE
4616219,0.00026302,0.029032996,Brooklyn,VNB E-GOWANUS N BROOKLYN GANTRY UPPER LEVEL - 92ND STREET
4616225,0.000298193,0.052894133,Queens,TBB N QUEENS ANCHORAGE - BE N
4763651,0.007721921,0.059757283,Brooklyn,VNB W BROOKLYN GANTRY LOWER LEVEL - SI GANTRY LOWER LEVEL
4456450,5.6205620978435775e-05,0.025184281577670962,Manhattan,FDR N - TBB E 116TH STREET - MANHATTAN TRUSS
4456478,3.126445981266336e-05,0.22796793517001612,Queens,BE S TBB EXIT RAMP - QUEENS ANCHORAGE
4456479,0.000361801,0.049872434,Queens,BE S TBB EXIT RAMP - MANHATTAN LIFT SPAN
4763650,0.00094738,0.2581836222843837,Staten Island,SIE E VNB E FINGERBOARD ROAD - SI GANTRY LOWER LEVEL
4616218,0.000668334,0.026735826154473664,Brooklyn,VNB E-GOWANUS N BROOKLYN GANTRY LOWER LEVEL - 92ND STREET
4616350,0.092087491,0.012140039103055672,Queens,CIP S LIE - Hempstead Tpk
4362342,0.11731390081733063,0.028512590444440312,Queens,LIE E 84TH ST - 108TH ST
4616193,0.064954957,0.060762163164683844,Staten Island,SIE E BRADLEY AVENUE - CLOVE ROAD
4616352,0.070522401,0.011619420796954116,Queens,CIP S Hempstead Tpk - Laurelton Pkwy @ SSP
4616346,0.002643739,0.15776436363037852,Manhattan,Westside Hwy S GWB - 57th St
4616226,0.00039107,0.054418672018870656,Brooklyn,GOW S 7TH AVENUE - 92ND STREET
4616232,0.003457112,0.16800824277523219,Brooklyn,BQE S 46TH STREET - LEONARD STREET
4763652,0.003012323,0.11496387039016324,Brooklyn,VNB E SI GANTRY UPPER LEVEL - BROOKLYN GANTRY UPPER LEVEL
4456452,3.9520265576184675e-05,0.011460877017093555,Manhattan,TBB W - FDR S MANHATTAN TRUSS - E116TH STREET
4616353,0.027310462,0.08225005,Queens,Laurelton Pkwy N @ SSP - CIP N Hempstead Tpk
4616192,0.043337008,0.056255171,Staten Island,SIE E CLOVE ROAD - FINGERBOARD ROAD